{
  "$schema": "redundant-v0.1.schema.json",
  "contract_version": "r8-redundant-v0.1-vectors-v1",
  "status": "real-reviewed-synthetic-artifact",
  "synthetic_only": true,
  "synthetic_material_notice": "SYNTHETIC TEST-ONLY: fixed non-operational material; never a runtime default, credential, or deployment input.",
  "cryptography": {
    "implementation": "independent construction using cryptography ChaCha20Poly1305 and hashlib/hmac SHA-256 HKDF extract/expand; no product r8session/r8-session dependency",
    "shared_secret_hex": "000102030405060708090a0b0c0d0e0f101112131415161718191a1b1c1d1e1f",
    "transcript_hash_hex": "a0a1a2a3a4a5a6a7a8a9aaabacadaeafb0b1b2b3b4b5b6b7b8b9babbbcbdbebf",
    "hkdf_extract_salt_hex": "a0a1a2a3a4a5a6a7a8a9aaabacadaeafb0b1b2b3b4b5b6b7b8b9babbbcbdbebf",
    "hkdf_prk_hex": "417e7502c38837c356dc6d3f1c84cfac0efea0e929628cb89ce52f74716620ad",
    "hkdf_info_format": "ASCII R8 key v1 || wire_version:u8 || session_version:u8 || profile:u8 || transcript_hash:32 || sender_role:u8 || receiver_role:u8 || path_slot:u8",
    "keys": {
      "c2s_slot0_key_hex": "8b11176b1599313aba58254fbc84ba9138ffa8b7f7cc8a054021880d41f3fa5c",
      "c2s_slot1_key_hex": "0a23ee0d8ae974cb78b599a5fc30cdbbd667d5a38ad7f5eaa3055930834338f3",
      "s2c_slot0_key_hex": "2668812e3a6abb07b997caa99c9c65cb18f9743199dccaad9f6739032c6f310b",
      "s2c_slot1_key_hex": "cae632ad62440bb7a5dd959745c6cb70eebd7d6ce0588d6ac5aff58e5f9e2f29"
    }
  },
  "common": {
    "scid": 72623859790382856,
    "source_loc_hex": "20010db8000000000000000000000001",
    "destination_loc_hex": "20010db8000000000000000000000002",
    "wire_version": 8,
    "session_version": 1,
    "profile": 3,
    "binding_budget": 1280,
    "profile3_overhead": 84
  },
  "repr_claims": {
    "key_material_redacted_in_repr": true,
    "plaintext_redacted_in_repr": true,
    "allowed_repr_tokens": [
      "<RedundantSession>",
      "[REDACTED]"
    ]
  },
  "positive_cases": [
    {
      "id": "p3-data-slot0",
      "kind": "positive",
      "direction": "c2s",
      "slot": 0,
      "plaintext_hex": "73796e74686574696320726564756e64616e74207061796c6f6164",
      "header_hex": "8300003f03400100010203040506070820010db800000000000000000000000120010db8000000000000000000000002",
      "prefix_hex": "06010300",
      "counter": 1,
      "delivery_id": 1230066625199609624,
      "nonce_hex": "000000000000000000000001",
      "aad_hex": "8300003f03000100010203040506070820010db800000000000000000000000120010db80000000000000000000000020601030000000000000000011112131415161718",
      "ciphertext_hex": "735fe3853808bf81d5f71c6605ffc8421d921b3ec8e9ea0fc47bc3",
      "tag_hex": "1d467f2d75e05e85ade74a0d12f15b16",
      "full_packet_hex": "8300003f03400100010203040506070820010db800000000000000000000000120010db80000000000000000000000020601030000000000000000011112131415161718735fe3853808bf81d5f71c6605ffc8421d921b3ec8e9ea0fc47bc31d467f2d75e05e85ade74a0d12f15b16",
      "exact_size": 111,
      "binding_budget": 1280,
      "budget_remaining": 1169
    },
    {
      "id": "p3-data-slot1",
      "kind": "positive",
      "direction": "c2s",
      "slot": 1,
      "plaintext_hex": "73796e74686574696320726564756e64616e74207061796c6f6164",
      "header_hex": "8300003f03400301010203040506070820010db800000000000000000000000120010db8000000000000000000000002",
      "prefix_hex": "06010300",
      "counter": 1,
      "delivery_id": 1230066625199609624,
      "nonce_hex": "000000000000000000000001",
      "aad_hex": "8300003f03000301010203040506070820010db800000000000000000000000120010db80000000000000000000000020601030000000000000000011112131415161718",
      "ciphertext_hex": "fb680ee7738640417821977d7cdb0505c4254bfe7b9c4df8109ca8",
      "tag_hex": "130917eac918b4f9e2a23ac3810a93db",
      "full_packet_hex": "8300003f03400301010203040506070820010db800000000000000000000000120010db80000000000000000000000020601030000000000000000011112131415161718fb680ee7738640417821977d7cdb0505c4254bfe7b9c4df8109ca8130917eac918b4f9e2a23ac3810a93db",
      "exact_size": 111,
      "binding_budget": 1280,
      "budget_remaining": 1169
    },
    {
      "id": "p3-empty-slot0",
      "kind": "positive",
      "direction": "c2s",
      "slot": 0,
      "plaintext_hex": "",
      "header_hex": "8300002403400100010203040506070820010db800000000000000000000000120010db8000000000000000000000002",
      "prefix_hex": "06010300",
      "counter": 2,
      "delivery_id": 1230066625199609625,
      "nonce_hex": "000000000000000000000002",
      "aad_hex": "8300002403000100010203040506070820010db800000000000000000000000120010db80000000000000000000000020601030000000000000000021112131415161719",
      "ciphertext_hex": "",
      "tag_hex": "5607ec43e2c5ab813385fb32419f9f75",
      "full_packet_hex": "8300002403400100010203040506070820010db800000000000000000000000120010db800000000000000000000000206010300000000000000000211121314151617195607ec43e2c5ab813385fb32419f9f75",
      "exact_size": 84,
      "binding_budget": 1280,
      "budget_remaining": 1196
    },
    {
      "id": "p3-boundary-slot0",
      "kind": "positive",
      "direction": "c2s",
      "slot": 0,
      "plaintext_hex": "000102030405060708090a0b0c0d0e0f101112131415161718191a1b1c1d1e1f202122232425262728292a2b2c2d2e2f303132333435363738393a3b3c3d3e3f404142434445464748494a4b4c4d4e4f505152535455565758595a5b5c5d5e5f606162636465666768696a6b6c6d6e6f707172737475767778797a7b7c7d7e7f808182838485868788898a8b8c8d8e8f909192939495969798999a9b9c9d9e9fa0a1a2a3a4a5a6a7a8a9aaabacadaeafb0b1b2b3b4b5b6b7b8b9babbbcbdbebfc0c1c2c3c4c5c6c7c8c9cacbcccdcecfd0d1d2d3d4d5d6d7d8d9dadbdcdddedfe0e1e2e3e4e5e6e7e8e9eaebecedeeeff0f1f2f3f4f5f6f7f8f9fafbfcfdfeff000102030405060708090a0b0c0d0e0f101112131415161718191a1b1c1d1e1f202122232425262728292a2b2c2d2e2f303132333435363738393a3b3c3d3e3f404142434445464748494a4b4c4d4e4f505152535455565758595a5b5c5d5e5f606162636465666768696a6b6c6d6e6f707172737475767778797a7b7c7d7e7f808182838485868788898a8b8c8d8e8f909192939495969798999a9b9c9d9e9fa0a1a2a3a4a5a6a7a8a9aaabacadaeafb0b1b2b3b4b5b6b7b8b9babbbcbdbebfc0c1c2c3c4c5c6c7c8c9cacbcccdcecfd0d1d2d3d4d5d6d7d8d9dadbdcdddedfe0e1e2e3e4e5e6e7e8e9eaebecedeeeff0f1f2f3f4f5f6f7f8f9fafbfcfdfeff000102030405060708090a0b0c0d0e0f101112131415161718191a1b1c1d1e1f202122232425262728292a2b2c2d2e2f303132333435363738393a3b3c3d3e3f404142434445464748494a4b4c4d4e4f505152535455565758595a5b5c5d5e5f606162636465666768696a6b6c6d6e6f707172737475767778797a7b7c7d7e7f808182838485868788898a8b8c8d8e8f909192939495969798999a9b9c9d9e9fa0a1a2a3a4a5a6a7a8a9aaabacadaeafb0b1b2b3b4b5b6b7b8b9babbbcbdbebfc0c1c2c3c4c5c6c7c8c9cacbcccdcecfd0d1d2d3d4d5d6d7d8d9dadbdcdddedfe0e1e2e3e4e5e6e7e8e9eaebecedeeeff0f1f2f3f4f5f6f7f8f9fafbfcfdfeff000102030405060708090a0b0c0d0e0f101112131415161718191a1b1c1d1e1f202122232425262728292a2b2c2d2e2f303132333435363738393a3b3c3d3e3f404142434445464748494a4b4c4d4e4f505152535455565758595a5b5c5d5e5f606162636465666768696a6b6c6d6e6f707172737475767778797a7b7c7d7e7f808182838485868788898a8b8c8d8e8f909192939495969798999a9b9c9d9e9fa0a1a2a3a4a5a6a7a8a9aaabacadaeafb0b1b2b3b4b5b6b7b8b9babbbcbdbebfc0c1c2c3c4c5c6c7c8c9cacbcccdcecfd0d1d2d3d4d5d6d7d8d9dadbdcdddedfe0e1e2e3e4e5e6e7e8e9eaebecedeeeff0f1f2f3f4f5f6f7f8f9fafbfcfdfeff000102030405060708090a0b0c0d0e0f101112131415161718191a1b1c1d1e1f202122232425262728292a2b2c2d2e2f303132333435363738393a3b3c3d3e3f404142434445464748494a4b4c4d4e4f505152535455565758595a5b5c5d5e5f606162636465666768696a6b6c6d6e6f707172737475767778797a7b7c7d7e7f808182838485868788898a8b8c8d8e8f909192939495969798999a9b9c9d9e9fa0a1a2a3a4a5a6a7a8a9aaab",
      "header_hex": "830004d003400100010203040506070820010db800000000000000000000000120010db8000000000000000000000002",
      "prefix_hex": "06010300",
      "counter": 3,
      "delivery_id": 1230066625199609626,
      "nonce_hex": "000000000000000000000003",
      "aad_hex": "830004d003000100010203040506070820010db800000000000000000000000120010db8000000000000000000000002060103000000000000000003111213141516171a",